"ID","Gemeinde_color","Ja_Stimmen_In_Prozent","Nein_Stimmen_In_Prozent","Gemeinde_de","Text_de"
3101,10.2,10.2,89.8,"Appenzell AI","89,8 Prozent der Stimmbürgerinnen und Stimmbürger von Appenzell sagen Nein zur Umweltverantwortungsinitiative. Appenzell hat damit bei dieser Vorlage den höchsten Nein-Anteil im Kanton Appenzell Innerrhoden."
3102,62.7,62.7,37.3,"Gonten AI","62,7 Prozent der Abstimmenden in der Gemeinde Gonten haben Ja gesagt zur Umweltverantwortungsinitiative. Gonten hat damit bei dieser Vorlage den höchsten Ja-Anteil im Kanton Appenzell Innerrhoden."
3104,45.5,45.5,54.5,"Schlatt-Haslen AI","In Schlatt-Haslen hat die Stimmbevölkerung die Umweltverantwortungsinitiative abgelehnt. Das Volksbegehren wurde mit einem Nein-Stimmen-Anteil von 54,5 Prozent verworfen. Schlatt-Haslen hat damit anders abgestimmt als der Kanton Appenzell Innerrhoden, der die Vorlage angenommen hat."
3111,15,15,85,"Oberegg AI","In Oberegg hat die Stimmbevölkerung die Umweltverantwortungsinitiative abgelehnt. Das Volksbegehren wurde mit einem Nein-Stimmen-Anteil von 85 Prozent verworfen. Oberegg hat damit anders abgestimmt als der Kanton Appenzell Innerrhoden, der die Vorlage angenommen hat."
3112,51,51,49,"Schwende-Rüti AI","Ja zur Umweltverantwortungsinitiative in Schwende-Rüti. Die Gemeinde hat das Volksbegehren mit 51 Prozent der Stimmen angenommen. Schwende-Rüti hat damit gleich wie der Kanton Appenzell Innerrhoden Ja gesagt zu dieser Vorlage."
