"ID","Gemeinde_color","Ja_Stimmen_In_Prozent","Nein_Stimmen_In_Prozent","Gemeinde_de","Text_de"
3101,26.9,26.9,73.1,"Appenzell AI","73,1 Prozent der Stimmbürgerinnen und Stimmbürger von Appenzell sagen Nein zur Umweltverantwortungsinitiative. Appenzell hat damit gleich wie der Kanton Appenzell Innerrhoden Nein gesagt zu dieser Vorlage."
3102,59.5,59.5,40.5,"Gonten AI","59,5 Prozent der Abstimmenden in der Gemeinde Gonten haben Ja gesagt zur Umweltverantwortungsinitiative. Gonten hat damit anders abgestimmt als der Kanton Appenzell Innerrhoden, der die Vorlage abgelehnt hat."
3104,2.1,2.1,97.9,"Schlatt-Haslen AI","In Schlatt-Haslen hat die Stimmbevölkerung die Umweltverantwortungsinitiative abgelehnt. Das Volksbegehren wurde mit einem Nein-Stimmen-Anteil von 97,9 Prozent verworfen. Schlatt-Haslen hat damit bei dieser Vorlage den höchsten Nein-Anteil im Kanton Appenzell Innerrhoden."
3111,41.7,41.7,58.3,"Oberegg AI","In Oberegg hat die Stimmbevölkerung die Umweltverantwortungsinitiative abgelehnt. Das Volksbegehren wurde mit einem Nein-Stimmen-Anteil von 58,3 Prozent verworfen. Oberegg hat damit gleich wie der Kanton Appenzell Innerrhoden Nein gesagt zu dieser Vorlage."
3112,67.7,67.7,32.3,"Schwende-Rüti AI","Ja zur Umweltverantwortungsinitiative in Schwende-Rüti. Die Gemeinde hat das Volksbegehren mit 67,7 Prozent der Stimmen angenommen. Schwende-Rüti hat damit bei dieser Vorlage den höchsten Ja-Anteil im Kanton Appenzell Innerrhoden."
