"ID","Gemeinde_color","Ja_Stimmen_In_Prozent","Nein_Stimmen_In_Prozent","Gemeinde_de","Text_de"
1401,80.8,80.8,19.2,"Alpnach OW","Ja zur Umweltverantwortungsinitiative in Alpnach. Die Gemeinde hat das Volksbegehren mit 80,8 Prozent der Stimmen angenommen. Alpnach hat damit anders abgestimmt als der Kanton Obwalden, der die Vorlage abgelehnt hat."
1402,35,35,65,"Engelberg OW","In Engelberg hat die Stimmbevölkerung die Umweltverantwortungsinitiative abgelehnt. Das Volksbegehren wurde mit einem Nein-Stimmen-Anteil von 65 Prozent verworfen. Engelberg hat damit gleich wie der Kanton Obwalden Nein gesagt zu dieser Vorlage."
1403,62.9,62.9,37.1,"Giswil OW","In Giswil hat die Stimmbevölkerung der Umweltverantwortungsinitiative zugestimmt. Sie wurde mit einem Ja-Stimmen-Anteil von 62,9 Prozent angenommen. Giswil hat damit anders abgestimmt als der Kanton Obwalden, der die Vorlage abgelehnt hat."
1404,86.1,86.1,13.9,"Kerns OW","86,1 Prozent der Abstimmenden in der Gemeinde Kerns haben Ja gesagt zur Umweltverantwortungsinitiative. Kerns hat damit bei dieser Vorlage den höchsten Ja-Anteil im Kanton Obwalden."
1405,33.1,33.1,66.9,"Lungern OW","Keine Mehrheit für die Umweltverantwortungsinitiative in Lungern: Mit 8'315 Nein-Stimmen zu 4'113 Ja-Stimmen oder 66,9 Prozent hat die Gemeinde das Volksbegehren verworfen. Lungern hat damit gleich wie der Kanton Obwalden Nein gesagt zu dieser Vorlage."
1406,23,23,77,"Sachseln OW","Sachseln hat die Umweltverantwortungsinitiative mit 77 Prozent abgelehnt. Sachseln hat damit bei dieser Vorlage den höchsten Nein-Anteil im Kanton Obwalden."
1407,24.9,24.9,75.1,"Sarnen OW","In Sarnen hat die Umweltverantwortungsinitiative keine Mehrheit gefunden. Auf 75,1 Prozent der abgegebenen Stimmzettel stand ein Nein. Sarnen hat damit gleich wie der Kanton Obwalden Nein gesagt zu dieser Vorlage."
