"ID","Gemeinde_color","Ja_Stimmen_In_Prozent","Nein_Stimmen_In_Prozent","Gemeinde_de","Text_de"
1401,90.7,90.7,9.3,"Alpnach OW","Ja zur Umweltverantwortungsinitiative in Alpnach. Die Gemeinde hat das Volksbegehren mit 90,7 Prozent der Stimmen angenommen. Alpnach hat damit bei dieser Vorlage den höchsten Ja-Anteil im Kanton Obwalden."
1402,87.6,87.6,12.4,"Engelberg OW","In Engelberg hat die Stimmbevölkerung der Umweltverantwortungsinitiative zugestimmt. Sie wurde mit einem Ja-Stimmen-Anteil von 87,6 Prozent angenommen. Engelberg hat damit gleich wie der Kanton Obwalden Ja gesagt zu dieser Vorlage."
1403,78.4,78.4,21.6,"Giswil OW","In Giswil hat die Stimmbevölkerung der Umweltverantwortungsinitiative zugestimmt. Sie wurde mit einem Ja-Stimmen-Anteil von 78,4 Prozent angenommen. Giswil hat damit gleich wie der Kanton Obwalden Ja gesagt zu dieser Vorlage."
1404,62.6,62.6,37.4,"Kerns OW","62,6 Prozent der Abstimmenden in der Gemeinde Kerns haben Ja gesagt zur Umweltverantwortungsinitiative. Kerns hat damit gleich wie der Kanton Obwalden Ja gesagt zu dieser Vorlage."
1405,54.6,54.6,45.4,"Lungern OW","54,6 Prozent der Abstimmenden in der Gemeinde Lungern haben Ja gesagt zur Umweltverantwortungsinitiative. Lungern hat damit gleich wie der Kanton Obwalden Ja gesagt zu dieser Vorlage."
1406,37.6,37.6,62.4,"Sachseln OW","Sachseln hat die Umweltverantwortungsinitiative mit 62,4 Prozent abgelehnt. Sachseln hat damit bei dieser Vorlage den höchsten Nein-Anteil im Kanton Obwalden."
1407,83.1,83.1,16.9,"Sarnen OW","Die Gemeinde Sarnen hat die Umweltverantwortungsinitiative mit 83,1 Prozent Ja-Stimmen angenommen. Sarnen hat damit gleich wie der Kanton Obwalden Ja gesagt zu dieser Vorlage."
