"ID","Gemeinde_color","Ja_Stimmen_In_Prozent","Nein_Stimmen_In_Prozent","Gemeinde_de","Text_de"
1401,17,17,83,"Alpnach OW","Alpnach hat die Umweltverantwortungsinitiative mit 83 Prozent abgelehnt."
1402,17,17,83,"Engelberg OW","In Engelberg hat die Stimmbevölkerung die Umweltverantwortungsinitiative abgelehnt. Das Volksbegehren wurde mit einem Nein-Stimmen-Anteil von 83 Prozent verworfen."
1403,16.1,16.1,83.9,"Giswil OW","In Giswil hat die Stimmbevölkerung die Umweltverantwortungsinitiative abgelehnt. Das Volksbegehren wurde mit einem Nein-Stimmen-Anteil von 83,9 Prozent verworfen."
1404,13.6,13.6,86.4,"Kerns OW","Keine Mehrheit für die Umweltverantwortungsinitiative in Kerns: Mit 1'592 Nein-Stimmen zu 251 Ja-Stimmen oder 86,4 Prozent hat die Gemeinde das Volksbegehren verworfen."
1405,12.4,12.4,87.6,"Lungern OW","Keine Mehrheit für die Umweltverantwortungsinitiative in Lungern: Mit 616 Nein-Stimmen zu 87 Ja-Stimmen oder 87,6 Prozent hat die Gemeinde das Volksbegehren verworfen."
1406,23.7,23.7,76.3,"Sachseln OW","Sachseln hat die Umweltverantwortungsinitiative mit 76,3 Prozent abgelehnt."
1407,50,0,0,"Sarnen OW","Die Resultate dieser Gemeinde sind noch nicht bekannt."
